{
  "specversion": "1.0",
  "type": "org.alfresco.event.node.Updated",
  "id": "df708027-e0a8-4b30-92a5-0d19235a7800",
  "source": "/f6d21231-618e-4f12-a920-e498660c5b9d",
  "time": "2020-04-27T14:25:59.855866+01:00",
  "dataschema": "https://api.alfresco.com/schema/event/repo/v1/nodeUpdated",
  "datacontenttype": "application/json",
  "data": {
    "eventGroupId": "ce852a52-609e-4b7d-8438-04e211fd76a0",
    "resource": {
      "@type": "NodeResource",
      "id": "d366f805-853f-46ac-a81c-af9c257ee876",
      "name": "testFile.txt",
      "nodeType": "cm:content",
      "isFolder": false,
      "isFile": true,
      "createdByUser": {
        "id": "john.doe",
        "displayName": "John Doe"
      },
      "createdAt": "2020-04-27T14:25:59.852475+01:00",
      "modifiedByUser": {
        "id": "jane.doe",
        "displayName": "Jane Doe"
      },
      "modifiedAt": "2020-04-27T14:25:59.854153+01:00",
      "content": {
        "mimeType": "text/plain",
        "sizeInBytes": 16,
        "encoding": "UTF-8"
      },
      "primaryHierarchy": [
        "521aac1c-20eb-444b-a137-2da3d35ee1a8",
        "2641bbe1-39ff-44dc-b47f-736552ad46cc"
      ],
      "properties": {
        "cm:description": "test description.",
        "cm:title": "test title2"
      },
      "aspectNames": [
        "cm:titled",
        "cm:auditable"
      ]
    },
    "resourceBefore": {
      "@type": "NodeResource",
      "modifiedByUser": {
        "id": "jane.doe",
        "displayName": "Jane Doe"
      },
      "modifiedAt": "2020-04-27T14:25:59.854558+01:00",
      "properties": {
        "cm:title": "test title"
      }
    }
  }
}
